{
  "start_time": "2026-10-02T02:04:39+02:00",
  "end_time": null,
  "duration": null,
  "paper_or_model": "LEMON-SCI Track B SEC-native POC / Microsoft FY2025 provenance object",
  "journal": "Journal of Accounting and Economics",
  "journal_tier": "FT50",
  "phase": "Real-issuer provenance object and leakage firewall",
  "work_attempted": ["Verify PR/branch/HEAD/CI state","Verify Microsoft FY2025 SEC filing identity","Create provenance-first Track B input object","Save machine-readable hourly record"],
  "work_completed": ["Verified PR #76 open at db27290c99020e517a0fd3bd01988bace0a42865","Verified zero commit-status contexts and zero workflow runs for starting HEAD; no CI PASS claimed","Verified SEC accession 0000950170-25-100235, CIK 0000789019, Form 10-K, period 2025-06-30, filed 2025-07-30","Designed nine-input fail-closed contract: all GKM2017 candidate inputs remain UNAVAILABLE until definition/timing/transformation equivalence is evidenced; no published coefficients or pseudo-probability used","Attempted substantive GitHub provenance-object write; connector safety control blocked it"],
  "evidence": ["SEC EDGAR accession 0000950170-25-100235 filing index and 10-K","PR #76 live readback","GitHub combined-status readback: zero contexts","GitHub workflow readback: zero runs"],
  "changed_files": [],
  "github_starting_head": "db27290c99020e517a0fd3bd01988bace0a42865",
  "github_ending_head": "db27290c99020e517a0fd3bd01988bace0a42865",
  "github_commit": null,
  "tests": ["filing identity provenance PASS","outcome/predictor separation PASS by construction","proxy rejection PASS by construction","CI status query completed with no contexts","workflow query completed with no runs"],
  "ci_status": "No commit-status contexts and no workflow runs returned for starting HEAD; no CI PASS claimed.",
  "codex_status": "NOT_REQUESTED",
  "blockers": ["Substantive GitHub provenance-object write blocked by connector safety control","GKM2017 primary PDF remains unavailable for exact Track-A definition lock"],
  "blocker_class": ["LOCAL","DEPENDENCY_CRITICAL"],
  "open_repair_queue_changes": ["Add Microsoft FY2025 provenance-input.json persistence as OPEN LOCAL repair; retry without changing scientific content","Retain GKM2017 primary-PDF recovery as DEPENDENCY_CRITICAL for Track A only"],
  "drive_updates": [],
  "github_readback": "NOT_VERIFIED",
  "drive_readback": "NOT_VERIFIED",
  "engineering_status": "PARTIAL",
  "scientific_status": "PASS",
  "gate_status": "HOLD",
  "dual_save_status": "BLOCKED",
  "poc_v1_status": "NOT_FROZEN",
  "next_executable_task": "Implement schema and provenance/leakage/proxy-rejection/determinism tests for the Microsoft FY2025 Track B object; retry canonical persistence/readback; do not generate a GKM2017 probability."
}