{
  "start_time": "2026-10-04T13:02:02+02:00",
  "end_time": "2026-10-04T13:05:19+02:00",
  "duration": "3 minutes 17 seconds wall-clock; focused evidence review and execution, not padded to 15 minutes",
  "paper_or_model": "Park et al. (2021) COSO noncompliance deterministic classifier",
  "journal": "Journal of Accounting and Public Policy",
  "journal_tier": "ABS3",
  "phase": "negative-context / evidence-scope leakage falsification",
  "work_attempted": [
    "Reconstruct live PR #76, branch HEAD, CI/status, canonical records, persisted classifier/spec/tests, and repair queue",
    "Execute adversarial negative-context cases against the persisted classifier without modifying it",
    "Repeat the complete adversarial matrix to test deterministic output",
    "Document independent Codex findings and repair acceptance criteria"
  ],
  "work_completed": [
    "Verified PR #76 open at starting HEAD 4329eb135bf712734b85b010f6fb969b66d76386",
    "Executed seven-case negative-context matrix: 3/7 passed and 4/7 failed",
    "Confirmed deterministic reproduction across two executions with identical SHA-256 c73a7276a2048730c36d84e61d67232d52fa1e142c73baa2ac5ece3e7d185e31",
    "Persisted and read back review-068-negative-leakage.md",
    "Preserved the prior cutoff-patch two-failure counter and made no prohibited third repair attempt"
  ],
  "evidence": [
    "classifier.py blob 8f9def9dad81f78c80a8030072eea11c61016cec",
    "benchmark-spec.json blob 4b1930f6547ec4be5f2329782a395797633c56ff",
    "review artifact blob 1e6db2b64d63e94f4984b0e533d40ae39abd1d12",
    "Scientific review commit a1c82217fa0b43460eb1665156cc95dc72af3ab2",
    "False classifications observed for historical-only 1992, bibliography-only 2013, auditor-only 1992, and quoted-other-company 2013 contexts",
    "No workflow runs and no combined commit statuses observed for starting HEAD or review commit"
  ],
  "changed_files": [
    "Lemon-ICFR-US/research/scientific-compute-reuse/coso-noncompliance-poc/review-068-negative-leakage.md",
    "Lemon-ICFR-US/research/scientific-compute-reuse/hourly-build/run-068.json"
  ],
  "github_starting_head": "4329eb135bf712734b85b010f6fb969b66d76386",
  "github_ending_head": "a1c82217fa0b43460eb1665156cc95dc72af3ab2",
  "github_commit": "a1c82217fa0b43460eb1665156cc95dc72af3ab2",
  "tests": [
    "Eligible explicit management 1992: PASS",
    "Eligible explicit management 2013: PASS",
    "Management unversioned: PASS",
    "Historical-only 1992: FAIL; current classifier returned 1 instead of null",
    "Bibliography-only 2013: FAIL; current classifier returned 0 instead of null",
    "Auditor-only 1992: FAIL; current classifier returned 1 instead of null",
    "Quoted other-company 2013: FAIL; current classifier returned 0 instead of null",
    "Two-run determinism: PASS with identical result-payload SHA-256 c73a7276a2048730c36d84e61d67232d52fa1e142c73baa2ac5ece3e7d185e31"
  ],
  "ci_status": "NO_WORKFLOW_RUNS_AND_NO_COMBINED_STATUSES for starting HEAD and scientific review commit; no CI PASS claimed",
  "codex_status": "FINDINGS_OPEN",
  "blockers": [
    "F-067-01 BLOCKED_AFTER_2_ATTEMPTS: classifier cannot enforce fiscal-year-end cutoff; prior classifier/test patch persistence failed twice and was not retried",
    "F-068-01 OPEN: evidence-scope leakage permits historical, bibliography, auditor-only, and quoted-third-party false labels",
    "GH-LOG-BACKFILL BLOCKED_AFTER_2_ATTEMPTS: canonical GitHub hourly-build-log append remains queued",
    "PR-76-CI OPEN: no workflow/status evidence for current COSO commits; separate Codex YAML workflow finding remains unresolved"
  ],
  "blocker_class": [
    "LOCAL"
  ],
  "open_repair_queue_changes": [
    "Retain F-067-01 with persistent fail_count=2 and retry_state=BLOCKED_AFTER_2_ATTEMPTS; exact future action is a dedicated repair sweep with cutoff-aware classifier and boundary tests",
    "Add F-068-01 with fail_count=0; future repair must require verified management-ICFR evidence scope and fail closed for the four observed negative contexts",
    "Retain GH-LOG-BACKFILL with retry_state=BLOCKED_AFTER_2_ATTEMPTS; no master-log write was attempted this run",
    "Before promotion, add the seven-case matrix as executable tests, execute twice at the same exact repaired HEAD, obtain CI, and request fresh independent review"
  ],
  "drive_updates": [
    "Run 068 append to canonical Drive master log pending"
  ],
  "github_readback": "VERIFIED",
  "drive_readback": "NOT_VERIFIED",
  "engineering_status": "PARTIAL",
  "scientific_status": "PARTIAL",
  "gate_status": "HOLD",
  "dual_save_status": "PARTIAL",
  "poc_v1_status": "NOT_FROZEN",
  "next_executable_task": "Advance without retrying blocked patches: build the evidence-pack and section-bounded input contract design for the dedicated repair sweep, including temporal boundary, source-section, negation, quotation, and cross-company contamination cases."
}
